{
  "blocks": [
    {
      "block_id": "alpha-heading-001",
      "block_type": "HEADING",
      "level": 1,
      "parent_block_id": null,
      "provenance": {
        "bounding_box": null,
        "geometry_status": "NOT_AVAILABLE",
        "source_page": 1,
        "source_region": "page-1-heading-1",
        "source_snippet": "Quarterly evidence summary"
      },
      "reading_order": 1,
      "text": "Quarterly evidence summary"
    },
    {
      "block_id": "alpha-paragraph-001",
      "block_type": "PARAGRAPH",
      "parent_block_id": "alpha-heading-001",
      "provenance": {
        "bounding_box": null,
        "geometry_status": "NOT_AVAILABLE",
        "source_page": 1,
        "source_region": "page-1-paragraph-1",
        "source_snippet": "Reference 00017 remains text."
      },
      "reading_order": 2,
      "text": "Reference 00017 remains text."
    },
    {
      "block_id": "alpha-table-001",
      "block_type": "TABLE",
      "columns": [
        "Reference",
        "Amount"
      ],
      "parent_block_id": "alpha-heading-001",
      "provenance": {
        "bounding_box": null,
        "geometry_status": "NOT_AVAILABLE",
        "source_page": 1,
        "source_region": "page-1-table-1",
        "source_snippet": "00017 | 125.00"
      },
      "reading_order": 3,
      "rows": [
        [
          "00017",
          "125.00"
        ],
        [
          "00018",
          null
        ]
      ]
    },
    {
      "alt_text": "Synthetic grey rectangle labelled Figure 001",
      "asset_checksum": {
        "algorithm": "SHA-256",
        "computed_at": "UNKNOWN",
        "digest": "3466d2ac6072948c0fd16063cb0b1155234f3135eabd37145d43dfe1f727d633",
        "object_role": "DERIVATIVE"
      },
      "asset_reference": "assets/figure-001.svg",
      "block_id": "alpha-image-001",
      "block_type": "IMAGE",
      "media_type": "image/svg+xml",
      "parent_block_id": "alpha-heading-001",
      "provenance": {
        "bounding_box": null,
        "geometry_status": "NOT_AVAILABLE",
        "source_page": 2,
        "source_region": "page-2-image-1",
        "source_snippet": null
      },
      "reading_order": 4
    },
    {
      "block_id": "alpha-caption-001",
      "block_type": "CAPTION",
      "parent_block_id": "alpha-heading-001",
      "provenance": {
        "bounding_box": null,
        "geometry_status": "NOT_AVAILABLE",
        "source_page": 2,
        "source_region": "page-2-caption-1",
        "source_snippet": "Figure 001 — synthetic fixture"
      },
      "reading_order": 5,
      "target_block_id": "alpha-image-001",
      "text": "Figure 001 — synthetic fixture"
    }
  ],
  "content_id": "content-alpha-001",
  "document_id": "doc-alpha-001",
  "fidelity_mode": "SEMANTIC",
  "limitations": [],
  "reading_order_status": "VERIFIED",
  "schema_version": "1.0.0",
  "skill_id": "thien-skill-document-evidence",
  "skill_release_version": "1.1.0-rc.1",
  "source_content_id": "sha256:1111111111111111111111111111111111111111111111111111111111111111",
  "source_hash_status": "COMPUTED_ORIGINAL_BYTES",
  "structural_validation_status": "PASS"
}
