{
  "blocks": [
    {
      "block_id": "beta-heading-001",
      "block_type": "HEADING",
      "level": 1,
      "parent_block_id": null,
      "provenance": {
        "bounding_box": null,
        "geometry_status": "NOT_AVAILABLE",
        "source_page": 1,
        "source_region": "page-1-heading-1",
        "source_snippet": "Second synthetic document"
      },
      "reading_order": 1,
      "text": "Second synthetic document"
    },
    {
      "block_id": "beta-paragraph-001",
      "block_type": "PARAGRAPH",
      "parent_block_id": "beta-heading-001",
      "provenance": {
        "bounding_box": null,
        "geometry_status": "NOT_AVAILABLE",
        "source_page": 2,
        "source_region": "page-2-paragraph-1",
        "source_snippet": "Collection fixture content."
      },
      "reading_order": 2,
      "text": "Collection fixture content."
    }
  ],
  "content_id": "content-beta-001",
  "document_id": "doc-beta-001",
  "fidelity_mode": "SEMANTIC",
  "limitations": [],
  "reading_order_status": "VERIFIED",
  "schema_version": "1.0.0",
  "skill_id": "thien-skill-document-evidence",
  "skill_release_version": "1.1.0-rc.1",
  "source_content_id": "sha256:2222222222222222222222222222222222222222222222222222222222222222",
  "source_hash_status": "COMPUTED_ORIGINAL_BYTES",
  "structural_validation_status": "PASS"
}
